,posivite_score,bias_score,text
271,0.2705702781677246,0.4588594436645508,"Mike Pence officially launched his campaign for president on 7 June, in a rare instance of a former vice-president challenging the president with whom he shared a ticket a few years ago. Pence joined a crowded Republican field in which he has consistently polled third, even before he officially announced his candidacy, though he trails far behind DeSantis and Trump. Pence is angling for a wide base among evangelical Christians and has vowed to ban abortion if he is elected. He denounced the January 6 attack on the US Capitol, and has used it as a talking point against Trump, who turned against him after he publicly refused supporters’ calls to overturn the results of the election."
272,0.9175035953521729,0.8350071907043457,"Suarez, the mayor of Miami, is the first major Hispanic candidate seeking the Republican party nomination this election cycle. The son of Miami’s first Cuban-born mayor, Suarez has said he would broaden support for Republicans among Latino voters. He is the third candidate from Florida to join the crowded primary field, alongside frontrunners Donald Trump and Ron DeSantis. Suarez, who was first elected in 2017, filed paperwork to run the day after Trump appeared in a Miami court over federal charges and made his formal announcement on Good Morning America the day after that."
273,0.5654442310333252,0.1308884620666504,"In May, Scott became the second politician from South Carolina to run for the Republican nomination. He has served as a senator from South Carolina since 2013 when he was appointed by Republican challenger Nikki Haley to fill a vacancy. Scott, who is one of three Black members of the Senate and is the only Black Republican senator, said in his announcement speech that “America is not a racist country.” Scott joined fellow Republicans in opposing the Respect for Marriage Act in 2022. Scott served as a member of the House from 2011 to 2013 and before that spent stints in South Carolina’s general assembly and Charleston’s county council. During his 2010 campaign for the House of Representatives, Scott told Newsweek that homosexuality was a morally wrong choice."
274,0.5450671315193176,0.09013426303863525,"Senator Tim Scott of South Carolina has suspended his presidential campaign, conceding that he does not see any path to the Republican nomination as Donald Trump maintains a significant lead in primary polling."
275,0.4207445681095123,0.15851086378097545,Scott told Fox News in an interview on Sunday evening that he had suspended his campaign. His exit may provide a modest boost for other candidates trying to dislodge frontrunner Donald Trump from the top spot.
276,0.7358559966087341,0.47171199321746826,"“I think the voters, who are the most remarkable people on the planet, have been really clear that they’re telling me: ‘Not now Tim,’” he said."
277,0.8658262491226196,0.7316524982452393,"The news comes less than six months after Scott launched his White House bid with the promise of offering a more optimistic vision about America’s future, projecting the persona of a “happy warrior” ready to lead the Republican party into a new era. Scott, who is the only Black Republican serving in the Senate, used his own personal story as the child of a single mother to make an argument for America’s greatness, accusing Joe Biden and other Democrats of “attacking every rung of the ladder that helped me climb”."
278,0.5512052178382874,0.10241043567657471,"But that positive messaging failed to sway Republican primary voters, and Scott struggled to gain traction with a party base that remains largely loyal to Trump, despite the 91 felony counts against the former president."
279,0.6415075063705444,0.28301501274108887,"In more recent months, Scott explored darker rhetoric on the campaign trial in an apparent attempt to bolster his dwindling hopes of capturing the nomination. During the second Republican primary debate in late September, Scott implied that slavery had been more bearable for Black Americans than the Great Society, President Lyndon Johnson’s anti-poverty program that led to the creation of social welfare programs like Medicare and Medicaid. The comment won praise from Fox News commentators and sparked outrage among Scott’s critics, who accused Scott of downplaying the atrocities of slavery."
280,0.2125144451856613,0.5749711096286774,"Weeks after that incident, Scott lambasted Biden over his response to the attacks carried out by Hamas on 7 October, which killed more than 1,400 Israelis. Blasting Biden’s foreign policy agenda, Scott accused the president of inadvertently causing the violence."
281,0.4787917733192444,0.04241645336151123,"Scott later applauded the Israeli prime minister, Benjamin Netanyahu, for his “restraint” in his response to the Hamas attacks. At the time Scott made the comment, Israeli airstrikes in Gaza had already reportedly killed a large number of Palestinians."
282,0.7531892657279968,0.5063785314559937,"Privacy Notice: Newsletters may contain info about charities, online ads, and content funded by outside parties. For more information see our Privacy Policy. We use Google reCaptcha to protect our website and the Google Privacy Policy and Terms of Service apply."
283,0.4400858283042907,0.11982834339141857,"Despite Scott’s pivot to more severe rhetoric, his level of support in national primary polls remained in the low single digits, leaving him with no path to the nomination. Scott announced in October that he would shift his campaign resources to Iowa, zeroing in on the first voting state in a last-ditch effort to revive his campaign."
284,0.3045156896114349,0.39096862077713024,"But that strategy failed to lift Scott’s polling numbers, and he has now formally suspended his campaign, as Trump cements his status as the clear frontrunner in the race."
285,0.7826036214828491,0.5652072429656982,Fulton county prosecutors have asked the judge overseeing the 2020 election subversion case against Donald Trump and his co-defendants in Georgia to immediately impose an “emergency” protective order over the discovery materials to prevent potential future leaks of evidence.
286,0.4536687731742859,0.09266245365142822,"The request came after several media outlets published details of videotaped statements that former Trump lawyers Jenna Ellis, Sidney Powell and Kenneth Chesebro gave as part of plea deals to avoid being tried as racketeering co-defendants with the former president."
287,0.6674103736877441,0.3348207473754883,"The Fulton county district attorney Fani Willis had previously asked for a protective order for the discovery materials in the case. But citing the leak of several of the “proffer” interviews, Willis renewed the request on Tuesday to Fulton county superior court judge Scott McAfee."
288,0.7122805714607239,0.42456114292144775,"“The release of these confidential video recordings is clearly intended to intimidate witnesses,” the filing said, “subjecting them to harassment and threats prior to trial, constitutes indirect communication about the facts of this case with co-defendants and witnesses”."
289,0.2738181054592132,0.4523637890815736,"Trump has pleaded not guilty to charges that he and 18 co-defendants engaged in racketeering activity and conspired to overturn the results of the 2020 election results in the state of Georgia. To date, three of Trump’s ex-lawyers and a local Republican operative have taken plea deals."
290,0.7254674434661865,0.45093488693237305,"The actual motivation for the leaks were unclear. Ellis’s testimony, for instance, was widely seen as damaging to Trump – and the move to seek a protective order amounted to an aggressive play by prosecutors to suppress discussion of the proffers leading up to trial."
291,0.5085181593894958,0.0170363187789917,"Willis also said in the filing that she would take the unusual step of refusing to send copies of the video recordings to defense lawyers, and that they would instead have to watch the recordings at her office in downtown Atlanta, where they could only take notes."
292,0.3624262511730194,0.2751474976539612,"In the separate federal 2020 election subversion case brought against Trump in Washington, the discovery materials were subject to a protective order almost as soon as Trump was charged. But special counsel prosecutors have not forced Trump’s lawyers to only view the discovery in person."
293,0.6570266485214233,0.3140532970428467,"The prosecutors disclosed in their submission to the judge some back-and-forth communications they had with a couple defense lawyers over the leaks, including with Trump’s lawyer Steve Sadow, who had asked the district attorney’s office to state they had not leaked the material."
294,0.3936263024806976,0.21274739503860485,"Get all the latest updates from court as Trump faces several criminal cases, starting later this year."
295,0.7531892657279968,0.5063785314559937,"Privacy Notice: Newsletters may contain info about charities, online ads, and content funded by outside parties. For more information see our Privacy Policy. We use Google reCaptcha to protect our website and the Google Privacy Policy and Terms of Service apply."
296,0.5918192267417908,0.18363845348358154,"“The state had nothing to do with leaking any information to the media!” replied Nathan Wade, one of the top prosecutors on the case."
297,0.4882616102695465,0.023476779460906982,"But then a lawyer for Harrison Floyd, a Trump ally charged with harassing Georgia election worker Ruby Freeman, replied to the email chain on Tuesday morning, writing, “It was Harrison Floyd’s team.” The lawyer later said the statement was a typo and that they were not the leak."
298,0.6842138171195984,0.3684276342391968,"Willis first requested a protective order on 27 September. The delay with the protective order, according to a person familiar with the matter, has been over a protracted negotiation between the district attorney’s office and all 19 co-defendants over the language in the order."
299,0.6669405698776245,0.333881139755249,Donald Trump’s eldest son hailed the “sexiness” of his father’s properties after returning to the stand at the $250m fraud trial over the former president’s real estate empire.
300,0.7164178490638733,0.4328356981277466,Lawyers for the Trump Organization summoned Donald Trump Jr at the start of the seventh week of the New York civil trial.
301,0.7912506461143494,0.5825012922286987,"He showered praise on his father, who was not present in court on Monday. The former president “has been good at finding value, doing something differently” and identifying “sexiness within a real estate project”, Trump Jr said."
302,0.8074968457221985,0.614993691444397,"This helped the company attract licensing deals with other developers who wanted to emulate his style, Trump Jr suggested, adding that his father had “built some of the most incredible assets in the world”."
303,0.7060642242431641,0.4121284484863281,"“It’s just a sexy place,” he said of Trump Tower. The ex-president “really created a market for a sexy condominium”, his son told the court."
304,0.5857884883880615,0.17157697677612305,"The New York attorney general’s office is suing Donald Trump, his adult sons and other executives at the Trump Organization for inflating the value of assets on financial statements. They rested their case after Ivanka Trump testified last Wednesday."
305,0.4795728623867035,0.04085427522659302,"Trump faces a fine of at least $250m if found guilty at the end of the trial. The New York judge Arthur Engoron has already ruled Trump should have his business licenses revoked for fraud, although the ruling is going through an appellate court."
306,0.6470776200294495,0.2941552400588989,"The former president and three of his children – Trump Jr, Eric and Ivanka – have already been summoned to give evidence at trial by lawyers for the New York attorney general. Now defense lawyers are working through their own witness list."
307,0.4927926361560821,0.014414727687835804,"While Trump Jr and Eric are executive vice-presidents at the Trump Organization and named defendants alongside their father, Ivanka left the business in 2017 to serve in the White House, and is not a defendant."
308,0.3936263024806976,0.21274739503860485,"Get all the latest updates from court as Trump faces several criminal cases, starting later this year."
309,0.7531892657279968,0.5063785314559937,"Privacy Notice: Newsletters may contain info about charities, online ads, and content funded by outside parties. For more information see our Privacy Policy. We use Google reCaptcha to protect our website and the Google Privacy Policy and Terms of Service apply."
310,0.5327188968658447,0.06543779373168945,"In court Trump Jr described himself as the “big-picture deals guy”, while Eric was said to be involved in the day-to-day operations of the family business. Both brothers are “much more responsible than prior to 2017”, when their father assumed the presidency, he said."
311,0.369057834148407,0.26188433170318604,"Since 2021, however, when Trump left office, he “could get involved, and he chooses to, on certain things”, Trump Jr said."
312,0.7170754075050354,0.4341508150100708,"After concluding his testimony on Monday afternoon, the eldest Trump son reiterated previous criticisms of Letitia James, the New York attorney general, outside court. There is “no actual person complaining other than the attorney general herself”, he suggested."
313,0.5640999674797058,0.12819993495941162,"Joe Biden should sharpen his economic message by acknowledging voters’ pain and drawing a more direct contrast with Donald Trump to revive his ailing poll numbers, according to research presented to the White House and seen by the Guardian."
314,0.5050825476646423,0.010165095329284668,"Surveys by the Progressive Change Campaign Committee (PCCC), a grassroots organisation aligned with Senator Elizabeth Warren, found that voters trust Republicans over Democrats to handle the economy – but there are ways to close the gap by highlighting Trump’s past mistakes and threat to social security."
315,0.5882008075714111,0.17640161514282227,"“We cannot just repeat over and over again that the economy is doing great and expect repetition to win us the trust of the public,” said Adam Green, cofounder of the PCCC, who has held meetings with top officials in the White House, House of Representatives and Senate Democratic leadership and senior political operatives around Washington."
316,0.2665530145168304,0.4668939709663392,"America’s economy is performing well by most measures. Gross Domestic Product (GDP) rose at a 4.9% annual rate during the July to September quarter, defying predictions of a recession. Unemployment is at its lowest level for half a century and inflation has fallen to the lowest rate in any G7 country."
317,0.5049861073493958,0.009972214698791504,"But it appears that the public are not buying “Bidenomics”. In a recent New York Times and Siena College opinion poll, voters said they prefer Trump – the frontrunner for the Republican presidential nomination – over Biden on the economy by a 59% to 37% margin."
318,0.5534282326698303,0.10685646533966064,"National polling conducted by the PCCC and the Data for Progress thinktank from September to November rings further alarm bells going into Biden’s re-election campaign. Asked which party they trust more to handle the economy, 42% of likely voters say Republicans, 35% say Democrats and 20% say neither. But the research also found that message framing is crucial."
319,0.4555621147155761,0.08887577056884777,There are signs that the Biden re-election campaign is increasingly conscious of such dynamics.
320,0.6868302822113037,0.3736605644226074,"Whereas the president’s early speeches touting “Bidenomics” focused mainly on his accomplishments, more recently he has been highlighting the perceived threat of Republicans, while White House messaging has featured a “split screen” feature that draws a sharp contrast."
321,0.1674935966730117,0.6650128066539767,"The survey found that a message that blames Trump for gutting funding for pandemic preparedness, which left America unprepared for Covid-19, still leaves Democrats with a deficit of 14 percentage points. But asserting that Trump mismanaged the economy by cutting taxes for billionaires and failing to fight back against corporate price gouging on gas and groceries cuts the gap to just four points."
322,0.6279668211936951,0.25593364238739014,The PCCC’s research shows that Democrats can drive a contrast over taxing the wealthy to boost social security. The statement “Billionaires and other wealthy Americans should have to pay social security taxes at the same rate as other Americans” has support from 79% of independent voters.
323,0.4809381067752838,0.03812378644943237,"Furthermore, the assertion that “Democrats support increasing taxes on billionaires and support increasing funding for programs like social security” gives the party an 11-percentage point lead. While adding a second sentence – “Republicans are pushing to cut taxes on billionaires and are pushing to cut funding for programs like social security” – doubles the advantage to 22 percentage points."
324,0.7531892657279968,0.5063785314559937,"Privacy Notice: Newsletters may contain info about charities, online ads, and content funded by outside parties. For more information see our Privacy Policy. We use Google reCaptcha to protect our website and the Google Privacy Policy and Terms of Service apply."
325,0.4844127297401428,0.031174540519714355,"Green’s Progressive Change Institute found common ground with the White House, Congress and other partners in a recent initiative to crack down on junk fees, staging numerous public events that gained local media coverage. He has had numerous West Wing meetings to discuss the latest findings."
326,0.7223381996154785,0.44467639923095703,"“When we talked to the White House, Senate folks, House folks, everybody seemed to acknowledge that the data was intuitive and in some cases new. We identified pockets for future conversation strategically."
327,0.5165132880210876,0.03302657604217529,"A string of opinion polls have shown Biden trailing Trump in swing states, although Democrats’ strong performance in last week’s state elections, with abortion rights again a key issue, gave the 80-year-old president a timely boost."
328,0.7681935429573059,0.5363870859146118,But Republicans continue to target “Bidenflation” as a potential vote winner while Democrats have long been criticised for wonky communications that appeal to the head rather than the heart.
