,posivite_score,bias_score,text
97,0.6510821580886841,0.30216431617736816,"Forbes’ Dan Alexander did a quick fact check on the slideshow that Trump’s defense team has been using during Donald Trump Jr’s testimony. It appears the slideshow inaccurately said the building is 72 stories, though it’s actually 63 stories."
98,0.5453845858573914,0.09076917171478271,"It also said that the building is “directly” across from the New York Stock Exchange, which is inaccurate – it’s around the corner from the stock exchange."
99,0.5156607031822205,0.03132140636444092,"Trump Jr has been flying through the Trump Organization’s various properties, trying to establish his father as a “genius” real estate mogul."
100,0.8495523929595947,0.6991047859191895,"There was a brief back-and-forth with judge Arthur Engoron and prosecutors, who were objecting to the use of a valuation from Newmark real estate group that valued the Trump Doral golf course in Miami at $1.3bn in 2022."
101,0.4547394514083862,0.09052109718322765,Prosecutors argued that the presentation was hearsay and was outside the period of the case. Engoron said: “It’s completely irrelevant but there’s no jury here”.
102,0.3348726332187652,0.3302547335624696,"It’s clear that prosecutors are losing patience with Trump Jr’s testimony, but Engoron is maintaining that the Trump team wants this all on the record – even if it doesn’t necessarily help with their case – so he’ll let them get it on the record."
103,0.4091298878192901,0.1817402243614198,And we’re on for lunch break! Court will be back in session at 2.15pm.
104,0.4946323335170746,0.01073533296585083,Can confirm this is the vibe in the courtroom for the last hour and a half.
105,0.1097303852438926,0.7805392295122148,"I kinda feel like Don Jr. is not so much testifying in his own defense, but rather is trying to sell me a condo."
106,0.3829534351825714,0.23409312963485718,We’re still in the middle of Donald Trump Jr talking about Trump Organization properties developed in the late-2000s.
107,0.8343074917793274,0.6686149835586548,"Trump Jr has been speaking highly of the properties and frequently lavishing praise on them, saying certain buildings are among the “tallest” in their cities and that the properties are seen as the “best” by experts."
108,0.9157329201698304,0.8314658403396609,Prosecutors objected Trump Jr referring to praise from other people and the other accolades he is constantly mentioning.
109,0.4895816147327423,0.02083677053451538,"“I’m not speculating, these are things that actually happened,” Trump Jr said, turning toward judge Arthur Engoron."
110,0.9066539406776428,0.8133078813552856,"We are well into over two hours with Donald Trump Jr on the stand, and the bulk of his testimony so far has been him talking about the Trump Organization’s real estate portfolio, in the style of a marketing presentation."
111,0.7876760363578796,0.5753520727157593,"Each slide contains a picture of a property, sometimes a ballroom or a golf course. Sometimes a picture of a Trump executives will appear."
112,0.637390673160553,0.27478134632110596,"“I won’t comment on that picture, I will refrain,” he said when a picture of Eric Trump came up on the slide. “A lot of Photoshop,” he joked."
113,0.6575384140014648,0.3150768280029297,A picture of Trump lawyer Alina Habba at a UFC match over the weekend is making the rounds as Habba is clearly wearing a “FJB” necklace and is holding up a clutch bedazzled with “Maga”.
114,0.1299858093261718,0.7400283813476565,It seems like Habba left those accessories at home today.
115,0.8856444358825684,0.7712888717651367,New York Jets owner Woody Johnson and Trump lawyer Alina Habba at the UFC match.
116,0.5006538033485413,0.0013076066970825195,"It seems like Donald Trump Jr is trying to use a different vocabulary than his father, who often invokes the word “beautiful” to describe his various properties."
117,0.9217675924301147,0.8435351848602295,"We’re back, and already Donald Trump Jr is back to talking about the Trump Organization’s properties. Now he’s talking about the Trump international golf course in Palm Beach."
118,0.5335661172866821,0.06713223457336426,"“That is the artistry that comes to fruition over and over. He took raw swampland that no one for decades had ever seen value you and turned it into … one of the finest golf clubs in the world,” he said."
119,0.9189274907112122,0.8378549814224243,Trump lawyer Clifford Robert certainly came up with his line of questioning with plenty of praises in mind.
120,0.9028744101524352,0.8057488203048704,"“This additional to detail, how would you describe this in terms of the other holes in the course?” Roberts asked, when asking Trump Jr about details in the Palm Beach golf course."
121,0.6437993049621582,0.2875986099243164,"“He just sees that other people don’t,” Trump Jr said."
122,0.692264199256897,0.38452839851379395,Donald Trump Jr said that his father was “on the leading edge of creativity” when Trump came up with the concept of the condominium hotel.
123,0.576878547668457,0.15375709533691406,"“A buyer can own a one-bedroom hotel,” Trump Jr explained on the stand, occasionally turning toward to a stone-faced Judge Arthur Engoron, a dramatic picture of the Trump hotel in New York City displayed for the courtroom. “When they’re not there, it’s generating income from them."
124,0.6903641819953918,0.3807283639907837,Engoron overruled a standing objection from prosecutors over Trump Jr talking so extensively about the history and portfolio of the company. Trump Jr has been talking about the properties for nearly an hour.
125,0.5214772820472717,0.04295456409454346,We’re on a 15-minute break.
126,0.5769333243370056,0.15386664867401123,"If you need a refresher of Donald Trump Jr’s testimony earlier this month, it was a lot of light-hearted jokes and “I don’t recall”."
127,0.6249972581863403,0.24999451637268066,"At one point, prosecutors pulled up an email from a Forbes reporter to the Trump Organization that included questions about the actual size of Trump’s triplex penthouse apartment in Trump Tower. Trump told the magazine that the unit was 33,000 sq ft, but documents had shown it was closer to 11,000 sq ft."
128,0.8024080395698547,0.6048160791397095,"“Insane amount of stuff there in regards to the Forbes inquiry,” Donald Jr wrote to other Trump Organization executives in response to the inquiry."
129,0.7672880291938782,0.5345760583877563,"When asked whether the Trump Organization conducted their own investigation into the matter after Forbes inquiry, Trump Jr said the organization received “hundreds” of questions from the magazine."
130,0.4440414905548095,0.11191701889038097,"Given that he’s kicking off the defense’s case, Trump Jr will probably appear to remember a lot more this time around, though on cross-examination, he will likely maintain that he was removed from the case’s financial statements."
131,0.4520407915115356,0.09591841697692882,Fox News is being sued by a former Capitol Hill reporter who accuses the network of discriminating and retaliating against him because he refused to appease Donald Trump and the former president’s supporters by propagating lies about the “stolen” 2020 election.
132,0.1708280891180038,0.6583438217639924,"Jason Donner, who worked for Fox News for 12 years as a Capitol Hill reporter and producer, accuses the network of firing him because he spoke out against the coverage of Trump’s stolen election lie and the storming of the Capitol building on 6 January 2021. He was the victim of a wider purge of the newsroom, the lawsuit claims, designed to hold up the network’s ratings by playing along with election denial."
133,0.4839049279689789,0.032190144062042236,"The suit, which is being heard by a federal court in Washington DC, gives a vivid account of Donner’s experiences during the January 6 insurrection. Once rioters had entered the Capitol building, he sheltered along with other reporters in the news booths connected to the Senate."
134,0.2877389788627624,0.4245220422744752,"The suit claims that after Fox News became the first media outlet to call Arizona for Joe Biden shortly before midnight on election night in 2020, the network faced a furious backlash from Trump and his supporters. Ratings suffered."
135,0.4079982936382293,0.18400341272354137,"“To win back viewership and pledge its loyalty to President Trump, Fox’s corporate leadership purged the news division and those reporters who spoke out against claims of election fraud,” it states."
136,0.4802591204643249,0.03948175907135021,"Donner also objected to the conspiracy theories being touted by Fox’s star host at the time, Tucker Carlson, who has since been fired. Donner particularly objected to Carlson’s Fox Nation program, Patriot Purge, but was told by a manager, the suit says, that there was “nothing they could do because Tucker has gotten bigger than the network”."
137,0.2005863189697265,0.598827362060547,"The former Fox News reporter claims that retaliation against him began in the spring of 2022. “It became evident to Donner he was now being targeted for speaking out against the false reporting on the election and the January 6 insurrection,” the lawsuit contends."
138,0.1817925423383712,0.6364149153232577,Donner was fired on 28 September 2022 on what he claims were pretextual grounds related to the sick day he had taken two days previously having fallen ill after a Covid-19 vaccination.
139,0.5449762344360352,0.08995246887207031,"The new suit is one of a spate of litigation that Fox is fielding relating to its handling of the stolen election lie. In April, the company settled with the voting equipment company Dominion for $787.5m in a defamation suit over false allegations about the firm’s involvement in “rigging” the 2020 election."
140,0.8315887451171875,0.663177490234375,"A similar $2.7bn suit from another voting machine company, Smartmatic, is ongoing."
141,0.121473804116249,0.757052391767502,"Maryanne Trump Barry, a retired US federal judge and older sister of the former president Donald Trump, has died. She was 86."
142,0.1206832230091095,0.758633553981781,Multiple news outlets said Barry died at her home on the Upper East Side in New York City. A person familiar with the matter told the New York Times that Barry was found early on Monday morning. Her cause of death was unknown.
143,0.6275253295898438,0.2550506591796875,"The eldest daughter of prominent New York property developer Fred Trump and Mary Anne MacLeod Trump, Barry became an assistant US attorney in 1974 before being appointed to the US district court for New Jersey by Ronald Reagan in 1983. Her appointment to the federal bench, the Times said, was aided by Donald Trump’s then “fixer, the lawyer Roy M Cohn”. In 1999, Barry was appointed to the US court of appeals for the third circuit by Bill Clinton."
144,0.668464720249176,0.33692944049835205,"In 2018, while Donald Trump was in the White House, a New York Times investigation of his tax affairs, aided by Mary L Trump, the president’s niece who had become alienated from the family, prompted a formal complaint over whether Barry engaged in tax schemes in the 1990s."
145,0.4697823226451874,0.060435354709625244,"The Times report claimed that Barry, who allegedly benefited financially, was able to use her position of power to benefit her family."
146,0.5769887566566467,0.15397751331329346,Barry retired from the federal bench in 2019.
147,0.5227736234664917,0.0455472469329834,"She was long said to be close to her younger brother, but his rise to power and chaotic White House term seemed to change the relationship."
148,0.74224853515625,0.4844970703125,"In 2020, Mary Trump released recordings in which her aunt could be heard criticising the then president."
149,0.7404323816299438,0.4808647632598877,"Barry was married to the late John Barry, a trial and appellate lawyer."
150,0.1294339895248413,0.7411320209503174,"Fred Trump Jr, the oldest of Donald Trump’s siblings and father to Mary L Trump, died in 1981, aged 42."
151,0.0859660729765892,0.8280678540468216,"Robert Trump, a younger brother of the former president, died in 2020 aged 71. His funeral was held at the White House."
152,0.1200175136327743,0.7599649727344514,"Donald Trump’s first wife, Ivana Trump, died aged 73 at her home in New York City last year. She is buried at Bedminster, the former president’s golf club in New Jersey."
153,0.4908892512321472,0.018221497535705566,"Donald Trump, 77, is the clear frontrunner for the Republican presidential nomination next year, despite facing 91 criminal charges and assorted civil threats."
154,0.4750809967517853,0.04983800649642944,Representatives for Trump did not immediately respond to a request for comment.
155,0.7589954733848572,0.5179909467697144,"n his new book, Jonathan Karl captures Donald Trump gloating. “She said she could never get crowds like that,” the former US president turned de facto Republican presidential nominee is quoted as saying, after a conversation with Angela Merkel, then chancellor of Germany."
156,0.4444184601306915,0.11116307973861705,"One Republican congressman, Karl notes, was left wondering whether Trump understood that Merkel was alluding to Adolf Hitler."
157,0.5813607573509216,0.16272151470184326,"Asking: “Which would be more unsettling: that he didn’t or that he did?”, Karl leaves the reader to judge."
158,0.8270832896232605,0.654166579246521,"The unnamed aide omitted two other possibilities: placing Karl’s book in your hands or on your bedside table. Tired of Winning is worth reading. It is well-paced, meticulously sourced and amply footnoted. Karl’s third installment on the Trump presidency and aftermath shines a needed light on how the Republican party has been recast and reshaped. Subtitled Donald Trump and the End of the Grand Old Party, it is an all-too-rare case of truth-in-advertising."
159,0.4193582832813263,0.1612834334373474,"With Trump and the GOP, it’s till death do us part."
160,0.4869826436042785,0.026034712791442982,"Bannon shares his disdain for Mike Lindell, one of the more pathetic characters in Trump’s orbit. The MyPillow guy and a passel of so-called “prophets” mistakenly claimed Trump would be “reinstated” as president during Joe Biden’s first term. Lindell boasted of holding receipts but never delivered. Bannon played along, until he didn’t."
161,0.5934800505638123,0.1869601011276245,"Like Lindell – like Trump – Bannon faces legal woes. He awaits sentencing for contempt of Congress and is set to stand trial in 2024 in New York on felony fraud and conspiracy charges. Elsewhere, Karl reminds the reader of Trump’s fondness for defamation and disdain for the truth. In last year’s Georgia US Senate race, for example, he repeatedly counseled Herschel Walker, a protege and one-time college football and NFL star, to falsely label the Rev Raphael Warnock, the incumbent Democratic senator, as a “child molester”."
162,0.3334667980670929,0.3330664038658142,"“But I got no evidence of that,” Walker pushed back."
163,0.7089669108390808,0.4179338216781616,Trump was undeterred.
164,0.5792835354804993,0.15856707096099854,"Before election day, Walker, who had a documented history of domestic violence, punted on Trump’s advice. The runoff was different. Walker let loose with the garbage furnished by Trump."
165,0.6628397107124329,0.3256794214248657,It was a lie. Warnock eked out a narrow win.
166,0.2260525077581405,0.547894984483719,"This year, a Manhattan jury found Trump defamed and physically abused the writer E Jean Carroll, who said he attacked her in a department store dressing room in the mid-1990s. Next year, just as the Republican primary gets under way, he will face a second civil suit in the matter."
167,0.7033950686454773,0.4067901372909546,Karl is anguished by the havoc Trump has wrought.
168,0.7238138914108276,0.4476277828216553,"And yet, in five of six electoral battlegrounds, Trump leads Biden in polls. The public views the US president as too old and Kamala Harris, his vice-president, as a lightweight."
169,0.7273299694061279,0.45465993881225586,Trump vows to weaponize the justice department and the FBI. He embraces the rhetoric of the Confederacy as he vows retribution. He parrots Hitler as he unleashes on the “enemy within” and brands opponents “vermin”.
170,0.8281052112579346,0.6562104225158691,"Americans should be alarmed, but not surprised. More than 30 years ago, Trump’s first wife, Ivana, let it be known that he kept a volume of Hitler’s speeches by the bed. In the White House, Trump reportedly told John Kelly, then his chief of staff, that Hitler “did a lot of good things”."
171,0.8185608386993408,0.6371216773986816,"ne of the strongest candidates for US president in 2024 may be one who’s not yet in the race. There’s growing evidence that Gavin Newsom, the charismatic and energetic Democratic governor of California, is running something of a shadow campaign to Joe Biden and ready to step up if, or when, the incumbent is out of the running."
172,0.5763248801231384,0.15264976024627686,"Several developments in recent days suggest Newsom, who romped to re-election a year ago without really campaigning, is ready to bring forward what was already expected to be a strong run for the presidency in 2028."
173,0.4863042831420898,0.027391433715820424,"There are mounting concerns inside the Democratic party, matching polling among voters, that Biden is too old for a second term, the start of which in January 2025 would see him two months past his 82nd birthday if re-elected. Some want him to stand down."
174,0.5933660864830017,0.18673217296600342,"Newsom, 56, is among a generation of younger, prominent and popular Democrats expected to emerge from the shadow of the old guard, and has stolen a march on his peers with a series of bold moves many analysts see as strategic."
175,0.6247896552085876,0.2495793104171753,"Even movie star Arnold Schwarzenegger, himself a Republican former two-term governor of California, thinks a Newsom run at the White House is inevitable."
176,0.4115664362907409,0.17686712741851818,"“I think it’s a no-brainer. Every governor from a big state wants to take that shot,” Schwarzenegger said earlier this year."
177,0.8397964835166931,0.6795929670333862,"But not all Democrats appear thrilled at the prospect. Pennsylvania US senator John Fetterman, at a dinner in Iowa, connected Newsom with Dean Philips, a congressman who said he is challenging Biden."
178,0.660496711730957,0.32099342346191406,"This week, Newsom made a financial donation to a Democratic mayoral candidate in Charleston, South Carolina, 2,800 miles from his governor’s mansion in Sacramento. Reaching into political elections in other states is, experts say, a sure sign of a potential presidential candidate wishing to raise their profile on the national stage."
179,0.5897101759910583,0.1794203519821167,"“South Carolina is an early state in the primary process for Democrats, and doing well in the early states is seen as momentum for later ones,” said Eric Schickler, professor of political science at University of California, Berkeley, and co-director of its institute of governmental studies."
180,0.3785703182220459,0.2428593635559082,Newsom has publicly denied that he has sights on Biden’s job.
181,0.4874433279037475,0.025113344192504994,"“I’m rooting for our president and I have great confidence in his leadership,” he told Fox News earlier this year."
182,0.387189507484436,0.22562098503112804,"But while Schickler believes Newsom’s own thinking about the timing of any White House run probably hasn’t changed, he says circumstances have."
183,0.7250277996063232,0.4500555992126465,"“The Democratic party’s nervousness about Biden has certainly increased, and with him polling behind Donald Trump in many states, his low approval ratings, young voters being especially disenchanted with Biden, all of that has heightened interest among a lot of party supporters in an alternative,” he said."
184,0.5990092754364014,0.19801855087280273,"That alternative might not be Kamala Harris, who as vice-president would usually be assumed Biden’s heir apparent. Her public approval is currently as low as the president’s."
185,0.8371288776397705,0.674257755279541,"So a rising, often progressive-leaning politician such as Newsom, with a wealth of executive and legislative experience, and a willingness to counter head-on Republican policies and personalities, makes for an attractive proposition."
186,0.6228993535041809,0.24579870700836182,"“It’s not a situation where there’s like 20, or 50, or 100 Democratic leaders who could be viewed as legitimate. If there were such a group, Newsom has positioned himself pretty well and would be on a very short list along with [Michigan governor] Gretchen Whitmer and a couple others,” Schickler said."
187,0.8715165257453918,0.7430330514907837,"“The problem is the party. There’s just a lot of different voices, a lot of different constituencies, and not really anybody or any group that could authoritatively say, ‘Oh, it’s Newsom’."
188,0.611526370048523,0.2230527400970459,Other not so subtle clues that Newsom has sights on higher office include his $10m (£8.2m) investment earlier this year in a new political action committee designed to spread the Democratic party’s message in Republican-held states he said have “authoritarian leaders directly attacking our freedoms”.
189,0.6115805506706238,0.22316110134124756,"Among the targets is Ron DeSantis, the hard-right Florida governor and faltering candidate for the 2024 Republican presidential nomination. The pair will debate each other on 30 November in a highly anticipated nationally televised event once billed as a clash of two leading White House contenders."
190,0.8156719207763672,0.6313438415527344,"“The idea of debating DeSantis was probably a lot more appealing when it really did look like he might actually defeat Trump. In that scenario, showing you can debate him and score a lot of points helps Newsom’s visibility with the party and makes his case that he would be an effective candidate,” Shickler said."
191,0.5026212334632874,0.005242466926574707,"Donald Trump can appear on the ballot for the Republican primary in Michigan, a state judge ruled on Tuesday, a setback to challengers who argue he is constitutionally disqualified from being president because of his actions on 6 January 2021."
192,0.1931440532207489,0.6137118935585022,The lawsuit is one of several that left-leaning groups have filed across the country arguing that section 3 of the 14th amendment bars Trump from holding office. The provision says anyone who takes an oath to the United States and then engages in “insurrection” or “rebellion” against the nation cannot hold office unless Congress votes by two-thirds majority to allow them. The measure was adopted after the civil war and has not been tested.
193,0.4583732485771179,0.08325350284576416,"In Michigan, that language does not prevent a candidate from appearing on the ballot for a party primary for the purposes of selecting a nominee, Judge James Robert Redford, of the Michigan court of claims, ruled on Tuesday. While he left the door open to a challenge should Trump become the nominee, he suggested courts could not prevent Trump from appearing on the ballot because the core question in the matter was one for Congress, not judges."
194,0.7656052112579346,0.5312104225158691,"Ron Fein, the legal director for Free Speech for People, who represented the challengers in the case, said the court “adopted a discredited theory that claims that only Congress can decide whether a presidential candidate fails to meet constitutional qualifications for office”."
195,0.3567095696926117,0.2865808606147766,Fein said his group would appeal the case to the Michigan supreme court and seek to bypass the Michigan court of appeals. Democrats have a 4-3 majority on the bench there. The Michigan case is being closely watched because it is one of several battleground states critical for a presidential candidate to win next year.
196,0.1458656936883926,0.7082686126232147,"“The Michigan supreme court should reverse this badly reasoned lower-court decision. While our appeal is pending, the trial court’s decision isn’t binding on any other court, and we continue our current and planned legal actions in other states to enforce section 3 of the 14th amendment against Donald Trump,” Fein said in a statement."
197,0.8115573525428772,0.6231147050857544,"Steven Cheung, a spokesman for the Trump campaign, praised the ruling."
198,0.3375543057918548,0.3248913884162904,"“Each and every one of these ridiculous cases have LOST because they are all un-constitutional leftwing fantasies orchestrated by monied allies of the Biden campaign seeking to turn the election over to the courts and deny the American people the right to choose their next president,” he said in a statement."
199,0.524857759475708,0.049715518951416016,"The Michigan secretary of state, Jocelyn Benson, a Democrat who was once an election law professor, tweeted she was “gratified that today’s court ruling affirms my position that under Michigan law anyone generally advocated by the news media to be a candidate for the Republican and Democratic nomination for president must be listed on the February 2024 primary ballot”."
