,posivite_score,bias_score,text
200,0.3621354401111603,0.27572911977767944,"Last week, the Minnesota supreme court also dismissed a 14th-amendment challenge, saying the constitutional provision could not block Trump from appearing on a primary ballot. A trial court in Colorado also oversaw a five-day evidentiary hearing on a challenge there and is expected to issue a ruling soon."
201,0.7437599301338196,0.48751986026763916,"Legal experts widely expect the ruling to be decided by the US supreme court, to which Trump appointed three of the six conservative justices that comprise a supermajority."
202,0.656601071357727,0.3132021427154541,"Donald Trump paid tribute on Tuesday to his sister, Maryanne Trump Barry, after her death at the age of 86, saluting her beauty and intellect but also complaining about what he called her “merciless” treatment by US news media after he became president in 2016."
203,0.4857009947299957,0.028598010540008545,Barry retired from the federal bench in 2019 after investigations of Trump family tax affairs seemed to implicate her in avoidance schemes.
204,0.086629532277584,0.826740935444832,"She died on Monday at her home on the Upper East Side, in New York City."
205,0.6447431445121765,0.289486289024353,"“My great sister, Maryanne, passed away yesterday at the age of 86,” Trump wrote on his social media platform, Truth Social, on Tuesday."
206,0.7564833760261536,0.5129667520523071,"It long been known that Barry received her first judicial appointment, from Ronald Reagan in 1983, thanks in large part to Roy Cohn, an infamous mafia-linked lawyer who was then Donald Trump’s fixer. Barry was appointed to the appeals court in 1999, by Bill Clinton, and assumed senior status in 2011."
207,0.719336211681366,0.43867242336273193,"Trump continued: “Her life was largely problem-free, PERFECT, until I made it difficult for her when I decided to run for president."
208,0.3920129239559173,0.2159741520881654,"In 2018, the New York Times said a blockbuster report on Trump’s taxes, which he had kept from public view, was in large part fueled by the discovery of a “disclosure form that … Maryanne … filed related to her Senate confirmation hearing”."
209,0.6737380027770996,0.3474760055541992,"A year after Barry retired, her niece, the writer and Trump critic Mary L Trump, released recordings in which her aunt was harshly critical of the then president."
210,0.524811863899231,0.049623727798461914,"Donald Trump now faces 91 criminal charges, including 17 regarding election subversion, and assorted civil trials. Nonetheless, he leads polling regarding the Republican presidential nomination by vast margins nationally and in battleground states."
211,0.648993968963623,0.2979879379272461,"He did not comment on Monday on his sister’s death. On Tuesday, before issuing his statement about his sister, he used his Truth Social platform to attack the New York attorney general, whose lawsuit over his business practices landed him and his family in court; to post favourable polling results; and to complain about the latest Marvel superhero film."
212,0.7852184176445007,0.5704368352890015,"Turning to his tribute to his deceased sibling, Trump said he would “never forget the many times people would come up to me and say, ‘Your sister was the smartest person on the court.’ I was always honoured by that, but understood exactly what they meant – they were right!"
213,0.3478855192661285,0.30422896146774303,"id you know Cuba has a Capitol in Havana that closely resembles its American counterpart? Edel Rodriguez does, and that’s one more reason why he, a Cuban American political cartoonist, was so disturbed by what happened in his adopted homeland on January 6."
214,0.2836034893989563,0.4327930212020874,"Rodriguez grew up in the shadow of a different sort of insurgency, the revolution that swept Fidel Castro to power in January 1959. He knew what it was like for a people to lose their freedoms under a dictatorship, and he knew the resulting desire to seek liberty, which he and his family did in the Mariel boatlift in 1980. So after 2016, when Donald Trump won the White House, uncomfortable memories from the not-so-distant past began to surface, never more so than on 6 January 2021."
215,0.8745748400688171,0.7491496801376343,"Now, Rodriguez has put it all down in a graphic-novel memoir, Worm: A Cuban-American Odyssey."
216,0.5274443626403809,0.05488872528076172,"“I don’t think most Americans realize what a coup is, or a coup attempt, how dangerous it is,” he says."
217,0.662764310836792,0.325528621673584,"In Worm, compelling artwork revisits January 6 and its immediate aftermath, when barbed wire surrounded the US Capitol and the national guard patrolled. Red-and-black images juxtapose Castro’s revolutionary soldiers, fists and rifles raised, with the QAnon Shaman and an American flag at half-staff."
218,0.6580280065536499,0.3160560131072998,"Ask Rodriguez which panels he is most proud of and he holds up a pair of two-page spreads. One, at the beginning of the narrative, depicts the Cuban revolution, Castro’s bearded army storming Havana atop tanks, that familiar-looking Capitol in the background. A panel found near the end of the memoir, meanwhile, shows the US Capitol rioters charging the seat of Congress, wearing Maga caps and brandishing multiple flags: American, Confederate, “Back-the-Blue” pro-police. The images are inverses of each other, the crowds marching in opposite directions."
219,0.3901213705539703,0.21975725889205944,"“It really does go to what I’m trying to say – two sides of the same coin,” Rodriguez says."
220,0.8875930309295654,0.7751860618591309,"Edel Rodriguez’s depiction of the Cuban revolution, in 1959. Photograph: Edel Rodriguez."
221,0.7967437505722046,0.5934875011444092,"Rodriguez’s depictions of Trump are now famous, making the covers of Time and Der Spiegel. The most striking is up for debate. Is it Trump’s face as a melting blob, which MSNBC likened to the Wicked Witch of the West? Trump holding a bloody knife in one hand and the severed head of the Statue of Liberty in the other, inspired by a picture of an Islamic State terrorist? Trump draped in an American flag, giving the Nazi salute?"
222,0.7180514931678772,0.4361029863357544,"“I think he brought a certain kind of extremism to politics in America,” Rodriguez says. “I felt that it needed to be addressed … I’m just not a fan of extremism of any sort."
223,0.6186451315879822,0.23729026317596436,"“The best way to deal with problems,” he says, is to hold democratic elections, and if your candidate doesn’t win, to try again in the next go-round. What he’s seen far too often instead is the authoritarian alternative of “men with guns – communists in Cuba, the Maga crowd in the US, or Isis”."
224,0.6057783365249634,0.21155667304992676,"n Worm, Rodriguez examines his first-hand experiences with dictatorship. In cold war Cuba, he lived an hour away from the capital, in the small town of El Gabriel. Although he remembers being far more tuned in to nature there than in the US, he also describes being indoctrinated in school, from the red beret he wore to the Castro personality cult that was instilled by teachers. His parents lived in fear that his father’s entrepreneurial streak might get them in trouble, including neighborhood snoops who put their curiosity to the use of the Communist party."
225,0.4848325550556183,0.030334889888763428,"A tip-off alerted Rodriguez’s father to stepped-up scrutiny, accelerating the decision to leave. The Mariel boatlift made things easier in some ways, harder in others, as Rodriguez now explains in Worm, which unfolds memories of tense exit negotiations with authorities; a state of limbo in a tent city; and the miraculous day when a rescue vessel came. For the Rodriguez family, it was a shrimp boat called Nature Boy. Castro released prisoners to join the exodus to America, some of whom packed the boat. It and a convoy of other vessels made it to US shores."
226,0.4858198165893554,0.028360366821289174,"As Cubans willingly left their homeland, Castro insulted them with a choice barb, the “worm” of the book’s title."
227,0.3457025587558746,0.30859488248825084,"“It’s what they would call us, being underground, taking from the system,” Rodriguez says."
228,0.7678419351577759,0.5356838703155518,"In Spanish, it’s gusano, which the author considered for a title."
229,0.7531892657279968,0.5063785314559937,"Privacy Notice: Newsletters may contain info about charities, online ads, and content funded by outside parties. For more information see our Privacy Policy. We use Google reCaptcha to protect our website and the Google Privacy Policy and Terms of Service apply."
230,0.2890980243682861,0.42180395126342785,"ecades later – after studying at the Pratt Institute, getting a big break at Time, marrying and raising a family and even going back to Cuba to see family and friends – Rodriguez felt familiar enough with authoritarianism in his birthplace to speak out against it in his new home. That desire increased over the course of Trump’s 2016 campaign and ensuing four years in power. The verbal attack on a Muslim Gold Star family … the Access Hollywood tape … the Muslim ban … it’s all there, and so are Rodriguez’s graphic-art ripostes. He gives Trump a distinctive look: yellow hair, orange skin, no eyes or nose, just a wide-open mouth."
231,0.3768304884433746,0.24633902311325084,Rodriguez has found approval – and backlash. He realized just how big the backlash had grown when he fielded a sympathetic audience question about his safety after giving a lecture in another country with a troubled history.
232,0.3180878758430481,0.3638242483139038,"Rodriguez will keep making waves with his art, even if it is now tinged with a sense of betrayal and loss, from an American dream that became a nightmare."
233,0.0097331032156944,0.9805337935686111,"“I think January 6 really did puncture a lot of what America means to people – not just myself, but many people in the world,” he says. “The US is the place you go to hope and dream. To see the US Congress get attacked, like some country in some other part of the world that has been attacked, like the parliament in Moscow getting attacked in the 1990s – to feel that shock, to see that in the US … I’m very sad, very disappointed."
234,0.5371894240379333,0.0743788480758667,Donald Trump Jr is expected to take the witness stand in New York for a second time as defense lawyers for the family firm make their case in the $250m fraud trial.
235,0.5383959412574768,0.07679188251495361,"Trump Jr is the first witness to testify from the defense’s witness list, which also includes Donald Trump and Eric Trump as witnesses, though it is unclear whether they will end up being called."
236,0.4270289540290832,0.1459420919418336,"The New York attorney general’s office is suing Trump, his adult sons and other executives at the Trump Organization for inflating the value of assets on financial statements. They rested their case after Ivanka Trump testified last Wednesday. Trump faces a fine of at least $250m if found guilty at the end of the trial. The New York judge Arthur Engoron has already ruled Trump should have his business licenses revoked for fraud, though the ruling is going through an appellate court."
237,0.3384191989898681,0.3231616020202638,"Trump’s eldest son had taken the stand on 1 November, where he said he did not work on the financial statements on the case – though he signed multiple documents affirming their fairness and accuracy – and said he expected banks to do their own “due diligence” rather than relying on the financial statements."
238,0.2967034876346588,0.4065930247306824,"“I know a lot of bankers that do their own due diligence,” Trump Jr said on the stand."
239,0.6293913125991821,0.25878262519836426,"Trump’s team did not question him during his first appearance. His lawyers will be trying to make their case that lenders were not harmed by and had actively sought out relationships with the Trump family. In testimony so far, the Trumps have downplayed the importance of the financial statements, saying they were exclusively handled by the organization’s accountants and legal departments and that the family typically had enough cash on hand to conduct deals."
240,0.4495787322521209,0.10084253549575817,"Though they were presented with multiple documents showing they were consulted over the financial statements and had signed off on deals where the statements were used to affirm the family’s net worth, the Trumps said they did not recall working on or using the statements."
241,0.4438823759555816,0.11223524808883678,"When Trump himself took the stand, he furiously ranted against the judge and New York attorney general Letitia James, whom he called a “political hack”. His children, especially Ivanka Trump, were calmer on the stand but similarly tried to undermine the importance of the financial statements."
242,0.1946588456630706,0.6106823086738589,"Trump’s defense team said they will wrap up their witness testimonies by 15 December. The trial is scheduled to go until 22 December, though it could end before then."
243,0.5279382467269897,0.05587649345397949,"The Biden White House condemned Donald Trump for promising, if re-elected president, to “root out” opponents within US society he called “communists, Marxists, fascists and radical left thugs that live like vermin”."
244,0.6344137191772461,0.2688274383544922,"“Employing words like ‘vermin’ to describe anyone who makes use of their basic right to criticise the government ‘echoes dictators’ like Hitler and Mussolini,” the White House spokesperson Andrew Bates said, quoting Washington Post coverage of Trump’s remarks."
245,0.7660359740257263,0.5320719480514526,"Trump is the clear frontrunner to face Joe Biden in an election rematch next year, enjoying vast leads for the Republican nomination in battleground and national polls despite facing 91 criminal charges, including election subversion, and assorted civil trials including a defamation case arising from a rape allegation a judge said was “substantially true”."
246,0.5680734515190125,0.1361469030380249,Trump leads or is close to Biden in numerous swing state polls.
247,0.7019532918930054,0.40390658378601074,"The former president spoke in Claremont, New Hampshire, on Saturday, in the middle of the Veterans Day weekend."
248,0.390945702791214,0.21810859441757202,"“The threat from outside forces is far less sinister, dangerous and grave than the threat from within,” said Trump, who was impeached, for a second time, for inciting the deadly January 6 attack on Congress in an attempt to stay in power."
249,0.3936263024806976,0.21274739503860485,"Get all the latest updates from court as Trump faces several criminal cases, starting later this year."
250,0.7531892657279968,0.5063785314559937,"Privacy Notice: Newsletters may contain info about charities, online ads, and content funded by outside parties. For more information see our Privacy Policy. We use Google reCaptcha to protect our website and the Google Privacy Policy and Terms of Service apply."
251,0.7892457842826843,0.5784915685653687,Trump has also said he would if re-elected consider suspending the US constitution in order to achieve his aims.
252,0.3836588859558105,0.23268222808837902,"The 2024 election promises to be historic as a long slate of Republican candidates seek to unseat the sitting president, Joe Biden. After the pandemic changed the way Americans campaigned and voted four years ago, and three years after thousands of rioters waged violent protest at the nation’s Capitol to upend the last election’s results, the US will face new obstacles in carrying out the democratic process."
253,0.476137638092041,0.04772472381591797,"Here is the list of candidates in the primary elections, held beginning in early 2024."
254,0.8127134442329407,0.6254268884658813,"Binkley, a Texas businessman, is a long-shot candidate who is also a pastor at Create church. The self-proclaimed far-right fiscal conservative criticized both Democrats and Republicans for not being able to balance the federal budget, and said he would focus on health costs, immigration reform and a national volunteer movement."
255,0.3356256186962127,0.3287487626075746,"Burgum, the governor of North Dakota, announced his campaign in an opinion piece for the Wall Street Journal on 6 June. Viewed as a surprise, long-shot candidate, he touted his experience as a career businessman and leaned on his small-town roots in an announcement video titled Change. As governor, Burgum signed into law a near-total abortion ban, which makes the procedure illegal after six weeks, and only permissible in cases of rape, incest or medical emergency up to that point. He supported Donald Trump for president in 2016 and in 2020."
256,0.399029940366745,0.20194011926651,"The former New Jersey governor has emerged as one of the harshest Republican critics of Donald Trump, whom he endorsed for president in 2016 after dropping out of the race. Christie says he broke ties with the former president after the January 6 insurrection at the US Capitol, claiming that he hadn’t spoken to Trump since then. Christie, a lawyer and a lobbyist who served as a US attorney appointed by George W Bush, announced he is running for president a second time on 6 June in New Hampshire during a town hall."
257,0.599213182926178,0.19842636585235596,"Governor Ron DeSantis of Florida is predicted to be the strongest contender for the GOP nomination against Donald Trump, consistently polling second among Republican primary voters. He made his formal announcement on Twitter, a Spaces event attended by roughly 300,000 users that was riddled with technological glitches, on 24 May. DeSantis, who has served as Florida’s governor since 2019 and handily defeated the Democratic challenger, Charlie Crist, in 2022, who previously represented Florida’s sixth congressional district as a member of the US House from 2012 to 2018. As governor, DeSantis has signed a slate of laws banning minors from receiving gender-affirming care and restricting education on sexual orientation and gender identity in schools, and he has become an outspoken critic of the Chinese Communist party."
258,0.6741339564323425,0.34826791286468506,"Haley, who got her start in politics as a member of South Carolina’s general assembly, was governor of South Carolina from 2011 to 2017. She ended her second term early to serve as US ambassador to the United Nations under Donald Trump before announcing her resignation in 2018. She became the first Republican to announce a run against Donald Trump, even though she previously said she would not run against him. Haley has vowed to “fix” the US immigration system by “stopping illegal immigration” and described herself as pro-life, but said a federal abortion ban was unrealistic. Haley, who is the daughter of Indian immigrants, would be the first US president of Asian descent, as well as the first woman."
259,0.2593899965286255,0.481220006942749,"Hutchinson is the former governor of Arkansas, a post he held from 2015 to 2023. The relatively unknown politician announced his candidacy in an interview on ABC days after Trump was indicted in a Manhattan court, saying the ex-president should drop out of the race. Hutchinson is a businessman and lawyer who was appointed by Ronald Reagan to serve as a US attorney. He also served a stint in the US House of Representatives, winning a congressional seat in 1996 when he replaced his brother, Tim, who ran for Senate."
260,0.766001284122467,0.5320025682449341,"The biotech entrepreneur and political newcomer announced his campaign in a video describing attacks on the “culture of free speech in America” and again on Fox News in an interview with now-fired Tucker Carlson. He is the author of Woke, Inc., a book that lobbies against “ESG” – a framework of corporate governance that encourages companies to consider the environment and social justice issues. Ramaswamy, the youngest candidate vying for the Republican nomination, has lobbied in favor of raising the national voting age to 25. Ramaswamy would be the first president of Asian and Indian descent. He has also vowed to pardon federally indicted Donald Trump."
261,0.5711015462875366,0.14220309257507324,"Former president Donald Trump is the top contender for the Republican party nomination, even as he faces several legal hurdles, including federal charges over obstructing justice and violating the Espionage Act. Trump, a longtime businessman, unsuccessfully ran for re-election as president in 2020, and refused to accept the outcome of the results. Trump most recently said he is pro-life, and would continue his hardline immigration stance in a second term if elected. He has also renewed attacks on trans people, especially athletes, and his anti-China agenda."
262,0.5285800695419312,0.057160139083862305,"Biden is the likely Democratic nominee for the 2024 presidential election. He announced his campaign for re-election on 25 April, exactly four years after he announced his previous, successful presidential campaign. While approval for Biden remains low, hovering just above 40%, political experts say he is the most likely candidate to defeat Donald Trump, the frontrunner for the Republican nomination. Biden has served in politics for over five decades and is running on a platform that includes abortion rights, gun reform and healthcare. At 81, he is the oldest president in US history."
263,0.5695290565490723,0.13905811309814453,"Dean Phillips, a three-term Democratic congressman from Minnesota, is challenging Biden, saying the next generation should have the opportunity to lead the country. Phillips is the heir to a distilling company and once co-owned a gelato company. He entered public office spurred by fighting back against Trump."
264,0.2663700580596924,0.46725988388061523,"Cenk Uygur announced the longest of long-shot campaigns in October. Now 53, the outspoken host of the progressive Young Turks TV show has no experience in elected office – though he did run for Congress in California in 2020 – but perhaps more importantly he was born in Istanbul, Turkey. Most legal scholars would say that makes him ineligible to be president, under article II, section I, clause 5 of the US constitution, which says only “natural born citizens” can hold the office. Uygur says otherwise, and promises to prove it in court. He also says Democrats need to ditch Biden or face losing the White House to Trump."
265,0.1721756309270858,0.6556487381458285,"Failed 2020 presidential candidate Marianne Williamson, who also unsuccessfully ran for a seat in the US House of Representatives in 2014, became the first Democratic candidate to announce she is running for president as a challenge to Joe Biden. Williamson, an author of self-help books, launched her long-shot bid with campaign promises to address climate change and student loan debt. She previously worked as “spiritual leader” of a Michigan Unity church."
266,0.522334098815918,0.04466819763183594,"Robert F Kennedy Jr, known for his work as an environmental lawyer and his anti-vaccine views, said he was running for president to end the “chronic disease epidemic”. Kennedy, who compared vaccine mandates during the Covid-19 pandemic to “Hitler’s Germany”, has promoted other baseless conspiracy theories such as telecom networks being used to control people. He is the nephew of John F Kennedy, the former Democratic president, who was assassinated in office, and is the son of 1968 Democratic presidential candidate Robert F Kennedy, who was assassinated on the campaign trail."
267,0.7099400758743286,0.4198801517486572,"The progressive activist Cornel West announced in a video posted to Twitter that he is running for president as a member of the People’s party, a third party headed by a former campaign staffer for Bernie Sanders. West is currently a professor of philosophy at Union Theological Seminary and previously worked at Harvard but resigned, saying the school had an “intellectual and spiritual bankruptcy of deep depths”."
268,0.1572500616312027,0.6854998767375946,"The rightwing political commentator and radio talkshow host announced his run for president on Fox News as a guest on the now-canceled Tucker Carlson Tonight on 20 April 2023. In 2021, Elder joined a list of Republicans seeking to replace Gavin Newsom, the Democratic governor of California, in a failed recall. The Los Angeles resident was an outspoken critic of the state’s mask mandates, calling them “a joke”."
269,0.3236494660377502,0.3527010679244996,"Former US Representative Will Hurd, of Texas, entered the crowded primary field as a moderate and critic of Donald Trump. Hurd announced his campaign in an interview on CBS. He followed that with a video posted online in which he called Trump a “lawless, selfish, failed politician” and laid out an agenda to curb “illegal immigration”, inflation, crime and homelessness. Hurd, who worked for nearly a decade in the CIA, served three terms in the House, from 2015 to 2021. He left office as the only Black Republican in the chamber."
270,0.3257792890071869,0.3484414219856262,"Johnson is a businessman who ran unsuccessfully for governor of Michigan in 2022 after providing fraudulent nominating signatures for that campaign. Originally from Illinois, Johnson founded dozens of companies, and lives in Michigan with his family. He has billed himself as Donald Trump “without the baggage” and has taken similar policy positions on curbing US debt and cracking down on the FBI."
